{
  "schema": "uvd.event/1",
  "event_id": "5b6c7d8e-9f0a-4b1c-8d2e-3f4a5b6c7d8e",
  "source": "mercado-ejemplo",
  "type": "mercado-ejemplo.order.paid",
  "subject": {
    "kind": "order",
    "id": "ord-0001"
  },
  "sequence": 3,
  "occurred_at": "2026-09-24T01:13:00Z",
  "actor": {
    "kind": "wallet",
    "id": "0.0.1234567",
    "role": "buyer"
  },
  "economic": {
    "amount": "2.50",
    "currency": "USDC",
    "network": "hedera:mainnet",
    "tx_hash": "0.0.1234567@1727140000.123456789"
  },
  "payload": {},
  "trace_id": "a3ce929d0e0e47364bf92f3577b34da6"
}
