{
  "schema": "uvd.event/1",
  "event_id": "9e8d7c6b-5a4f-4e3d-8c2b-1a0f9e8d7c6b",
  "source": "meshrelay",
  "type": "meshrelay.channel.closed",
  "subject": {
    "kind": "channel",
    "id": "#alpha"
  },
  "sequence": 9007199254740991,
  "occurred_at": "2026-09-24T01:12:00.000000001Z",
  "actor": {
    "kind": "system",
    "id": "turnstile"
  },
  "economic": {
    "amount": "1.5",
    "currency": "USDC",
    "network": "solana:5eykt4UsFv8P8NJdTREpY1vzqKqZKvdp",
    "tx_hash": "5Ejemp1o11111111111111111111111111111111111111111111111111111111111111111111111111111111"
  },
  "payload": {
    "closed_by": "expiry"
  },
  "trace_id": "00f067aa0ba902b7a3ce929d0e0e4736"
}
